<?xml version="1.0" encoding="UTF-8"?>
<!-- Collegamento alla DTD per la validazione strutturale -->
<!DOCTYPE utenti SYSTEM "utenti.dtd">

<!-- Elemento radice: contiene tutti gli utenti registrati -->
<!-- xsi:noNamespaceSchemaLocation indica il file XSD per la validazione tipizzata -->
<utenti xmlns:xsi="http://www.w3.org/2001/XMLSchema-instance"
        xsi:noNamespaceSchemaLocation="utenti.xsd">

    <!-- Utente 1: Sturzi -->
    <utente id="U01">
        <!-- Nome dell'utente -->
        <nome>Sturzi</nome>
        <!-- Indirizzo email usato come username per il login -->
        <email>sturzi@streaming.com</email>
        <!-- Password salvata come hash SHA-256 della parola "sturzi" -->
        <password_hash>b097ab40217791f08e09e2bd17526cde9de5f903ca1902b3ff8ed4e313eea120</password_hash>
        <!-- Data in cui l'utente si è registrato -->
        <data_registrazione>2024-01-15</data_registrazione>
    </utente>

    <!-- Utente 2: Scoscina -->
    <utente id="U02">
        <nome>Scoscina</nome>
        <email>scoscina@streaming.com</email>
        <!-- Hash SHA-256 della parola "scoscina" -->
        <password_hash>85f040139dec03e4a231f6a9be79e417b102a9f200a628675baa01a6426393ae</password_hash>
        <data_registrazione>2024-02-20</data_registrazione>
    </utente>

    <!-- Utente 3: D'Aurora -->
    <utente id="U03">
        <nome>D'Aurora</nome>
        <email>daurora@streaming.com</email>
        <!-- Hash SHA-256 della parola "daurora" -->
        <password_hash>fc6d84d488b56413e481a3a16811693c0d7625d23f12ef60fa5fd38c0f3a5759</password_hash>
        <data_registrazione>2024-03-10</data_registrazione>
    </utente>

    <!-- Utente 4: Zappacosta -->
    <utente id="U04">
        <nome>Zappacosta</nome>
        <email>zappacosta@streaming.com</email>
        <!-- Hash SHA-256 della parola "zappacosta" -->
        <password_hash>45a7d59ec71ba1c0f4ad105f400460ced76c70fe1d7892658f13538a64462765</password_hash>
        <data_registrazione>2024-04-05</data_registrazione>
    </utente>

</utenti>
